AI Tool,Category,Primary Strength,Best For Research,Avoid Using For,Cost,Access
Scite.ai,Search & Analysis,Citation context analysis,"Finding how papers cite each other, supporting vs. contrasting citations, assessing impact","Initial broad search, full-text reading",Paid (Free limited),"scite.ai"
Elicit,Search & Synthesis,Semantic search for papers,"Finding papers by concept not keywords, quick paper summaries, evidence extraction","Citation analysis, deep reading",Free + Paid tiers,"elicit.org"
Consensus,Quick Synthesis,Rapid evidence aggregation,"Seeing what papers agree on, quick yes/no questions, hypothesis validation","Nuanced synthesis, methodology review",Free + Paid,"consensus.app"
Perplexity,Current Information,Real-time web search,"Recent papers, preprints, grey literature, current debates, news about research","Citation-heavy academic search, archived papers",Free + Pro,"perplexity.ai"
Claude Chat,Deep Analysis,Long context + nuanced reasoning,"Deep paper analysis, synthesis across 20+ papers, rubric application, writing assistance","Real-time info, citation networks",Free + Pro,"claude.ai"
ChatGPT,Rapid Processing,Speed and versatility,"High-volume triage, quick summaries, brainstorming, draft generation","Very long papers (context limits), deep analysis",Free + Plus,"chat.openai.com"
Semantic Scholar,Academic Search,Free academic search engine,"Initial paper discovery, citation counts, influential citations, alerts","Citation context, evaluation",Free,"semanticscholar.org"
Research Rabbit,Literature Mapping,Visual citation networks,"Discovering related papers, mapping research landscape, finding key authors","Paper evaluation, full-text analysis",Free,"researchrabbit.ai"
Connected Papers,Citation Visualization,Visual paper relationships,"Understanding paper connections, finding seminal works, exploring fields","Search, evaluation, synthesis",Free (Limited),"connectedpapers.com"
Google Scholar,Basic Search,Comprehensive coverage,"Initial broad search, finding paper full-texts, tracking citations, alerts","Evaluation, synthesis, organization",Free,"scholar.google.com"
Zotero,Citation Management,Reference organization,"Storing papers, managing citations, browser integration, note-taking","Paper analysis, synthesis",Free (Open source),"zotero.org"
Mendeley,Citation Management,Reference + Social,"Managing references, PDF annotation, collaboration, discover via network","Deep analysis, synthesis",Free + Paid,"mendeley.com"
Notion,Organization,Flexible workspace,"Research notes, synthesis tables, project management, collaborative writing","Citation management, PDF handling",Free + Paid,"notion.so"
Obsidian,Knowledge Management,Linked notes + Local,"Building knowledge graphs, connecting ideas, Zettelkasten method, privacy","Citation management, collaboration",Free,"obsidian.md"
